{"$id":"urn:lima:v4:lima.workflow","$schema":"https://json-schema.org/draft/2020-12/schema","additionalProperties":false,"properties":{"revision":{"minimum":1,"type":"integer"},"stage_attempts":{"items":{"properties":{"artifact_id":{"pattern":"^[A-Za-z0-9][A-Za-z0-9._:-]{0,127}$","type":"string"},"content_digest":{"pattern":"^[0-9a-f]{64}$","type":"string"},"kind":{"enum":["lima.repository-profile","lima.audit-evidence-package","lima.vulnerability-evidence-package","lima.repair-verification-report","lima.workflow","lima.stage-attempt"],"type":"string"},"schema_version":{"pattern":"^4\\.[0-9]+$","type":"string"}},"required":["kind","artifact_id","content_digest","schema_version"],"type":"object"},"maxItems":256,"type":"array"},"status":{"enum":["accepted","classifying","materializing","auditing","audit_adjudicating","audit_gate","mining_planning","mining_env_preparing","mining_running","mining_adjudicating","repair_gate","repair_planning","repair_candidate_generation","repair_verifying","summarizing","terminal"],"type":"string"},"workflow_id":{"pattern":"^[A-Za-z0-9][A-Za-z0-9._:-]{0,127}$","type":"string"},"workflow_mode":{"enum":["full_chain","audit_only","verify_vep","repair_from_vep"],"type":"string"}},"required":["revision","stage_attempts","status","workflow_id","workflow_mode"],"title":"lima.workflow","type":"object"}