{"revision":2,"stage_attempts":[{"artifact_id":"attempt-audit-0001","content_digest":"418c461a1d82fcc9cbf6b60d1caad21e76491abe2d4f4a0a3a1a178cb15e8fb4","kind":"lima.stage-attempt","schema_version":"4.0"},{"artifact_id":"attempt-profile-0001","content_digest":"34746de4860ae5ce9ec69c43ad8c8ad596d4e79172a284bf3defc1a866edb259","kind":"lima.stage-attempt","schema_version":"4.0"}],"status":"audit_gate","workflow_id":"workflow-0001","workflow_mode":"full_chain"}